<?xml version="1.0" encoding="UTF-8"?>
<data xmlns="http://www.woltlab.com" xmlns:xsi="http://www.w3.org/2001/XMLSchema-instance" xsi:schemaLocation="http://www.woltlab.com http://www.woltlab.com/XSD/maelstrom/dashboardBox.xsd">
	<import>
		<dashboardbox name="com.woltlab.wcf.user.recentActivity">
			<classname><![CDATA[wcf\system\dashboard\box\RecentActivityDashboardBox]]></classname>
			<boxtype>content</boxtype>
		</dashboardbox>
		
		<dashboardbox name="com.woltlab.wcf.user.recentActivitySidebar">
			<classname><![CDATA[wcf\system\dashboard\box\RecentActivitySidebarDashboardBox]]></classname>
			<boxtype>sidebar</boxtype>
		</dashboardbox>
		
		<dashboardbox name="com.woltlab.wcf.user.registerButton">
			<classname><![CDATA[wcf\system\dashboard\box\RegisterButtonDashboardBox]]></classname>
			<boxtype>sidebar</boxtype>
		</dashboardbox>
		
		<dashboardbox name="com.woltlab.wcf.user.signedInAs">
			<classname><![CDATA[wcf\system\dashboard\box\SignedInAsDashboardBox]]></classname>
			<boxtype>sidebar</boxtype>
		</dashboardbox>
		
		<dashboardbox name="com.woltlab.wcf.user.statsSidebar">
			<classname><![CDATA[wcf\system\dashboard\box\StatsSidebarDashboardBox]]></classname>
			<boxtype>sidebar</boxtype>
		</dashboardbox>
		
		<dashboardbox name="com.woltlab.wcf.user.newestMembers">
			<classname><![CDATA[wcf\system\dashboard\box\NewestMembersDashboardBox]]></classname>
			<boxtype>sidebar</boxtype>
		</dashboardbox>
		
		<dashboardbox name="com.woltlab.wcf.user.mostActiveMembers">
			<classname><![CDATA[wcf\system\dashboard\box\MostActiveMembersDashboardBox]]></classname>
			<boxtype>sidebar</boxtype>
		</dashboardbox>
		
		<dashboardbox name="com.woltlab.wcf.like.mostLikedMembers">
			<classname><![CDATA[wcf\system\dashboard\box\MostLikedMembersDashboardBox]]></classname>
			<boxtype>sidebar</boxtype>
		</dashboardbox>
	</import>
</data>
